{
  "$schema": "https://json-schema.org/draft/2020-12/schema",
  "$id": "urn:amazonfill:schemas:af-level-1",
  "title": "Amazon Fill · paquete de niveles af-level/1",
  "description": "JSON Schema canónico del formato de nivel definido en docs/gdd/08-arquitectura-tecnica-publicacion.md §4.1 (pack_schema 1; única copia del esquema). Lo emite tools/level-generator y lo validan tools/level-qa y AF.Levels (comprobación: python tools/validate_schema.py). El esquema exige: patrones de id y seed de campaña (m{mm}_v{v}_n{nnnn} / amazonfill:v1:m{mm}:v{v}:n{nnnn}) y del Reto del río (kind daily: d{b}_n{nnnn} / amazonfill:v1:daily:b{b}:d{ddd}, 03 §16); relief con al menos una variante desde el nivel 31; par de relief nulo solo en plus_empty (03 §13). Lo que el esquema no puede expresar lo comprueba tools/level-qa: igualdad de longitud de caps, cuias y attrs; cada tinte con exactamente units_per_color unidades; tinte con level_debut posterior al nivel; risk_pairs <= max_risk_pairs; K (longitud de palette) <= k_max; par >= 2*K; label coherente con bot_fail (>=0,75 hard, >=0,90 very_hard); Aguas turbias con >=1 vertido seguro en todas las realidades y ocultos en <= 3 cuias; variantes de relief resolubles con bot_fail que baja >=0,20 (si el base tiene bot_fail <0,20, como los debuts de 02 §9.2, basta par menor en minus_color o el vacío extra de plus_empty); bot_fail en la ventana del slot (<0,20 en debuts); semilla que reproduce el tablero base; en daily, banda y día de slot coherentes con id y seed; <=14 cuias generadas (02 R1). Cualquier cambio de este archivo que altere la validación sube pack_schema; los cambios editoriales de description no.",
  "type": "object",
  "additionalProperties": false,
  "required": ["pack_schema", "pack_id", "generator", "pool", "k_min", "k_max", "max_risk_pairs", "cap_default", "empties_default", "levels"],
  "properties": {
    "pack_schema": {
      "type": "integer",
      "const": 1,
      "description": "Versión de la cabecera del pack. El cliente rechaza un paquete remoto con pack_schema mayor al que conoce."
    },
    "schema_file": {
      "type": "string",
      "const": "schemas/af-level-1.schema.json",
      "description": "Ruta, desde la raíz del repositorio, del JSON Schema contra el que se validó el pack."
    },
    "pack_id": {
      "type": "string",
      "pattern": "^(mundo_[0-9]{2}_v[1-9][0-9]*|daily_pool_v[1-9][0-9]*|event_[a-z0-9_]+_v[1-9][0-9]*)$",
      "description": "mundo_{mm}_v{vuelta} para la campaña (archivo mundo_{mm}_v{vuelta}.json), daily_pool_v{n} para el Reto del río, event_{nombre}_v{n} para eventos."
    },
    "kind": {
      "type": "string",
      "enum": ["campaign", "daily", "event"],
      "default": "campaign",
      "description": "campaign (por defecto) / daily / event. En daily (pool del Reto del río, 03 §16) cada nivel lleva slot en lugar de level, id d{b}_n{nnnn} y seed amazonfill:v1:daily:b{b}:d{ddd}; difficulty, world y lap son opcionales y la cabecera no exige world, world_id, lap ni water_base (el pool mezcla mundos; cada tablero declara su water_base)."
    },
    "generator": {
      "type": "object",
      "additionalProperties": false,
      "required": ["tool", "version"],
      "properties": {
        "tool": { "type": "string", "const": "level-generator" },
        "version": { "$ref": "#/$defs/semver" },
        "commit": { "type": "string", "pattern": "^[0-9a-f]{7,40}$" },
        "built_at": { "type": "string", "format": "date-time" }
      }
    },
    "world": { "$ref": "#/$defs/world", "description": "Obligatorio en campaign y event; opcional en daily." },
    "world_id": {
      "type": "string",
      "pattern": "^w[0-9]{2}_[a-z0-9_]+$",
      "description": "Identificador del mundo (glosario §8), p. ej. w03_manaos. Obligatorio en campaign y event; opcional en daily."
    },
    "lap": { "$ref": "#/$defs/lap", "description": "Obligatorio en campaign y event; opcional en daily." },
    "water_base": { "$ref": "#/$defs/water_base", "description": "Obligatorio en campaign y event; opcional en daily." },
    "pool": {
      "type": "array",
      "minItems": 1,
      "maxItems": 14,
      "uniqueItems": true,
      "items": { "$ref": "#/$defs/tint_id" },
      "description": "Tintes disponibles en el mundo (IDs de tints.json); en daily, los de todas las bandas del pool."
    },
    "k_min": { "type": "integer", "minimum": 2, "maximum": 14 },
    "k_max": { "type": "integer", "minimum": 2, "maximum": 14 },
    "max_risk_pairs": { "type": "integer", "minimum": 0, "maximum": 10 },
    "cap_default": { "$ref": "#/$defs/capacity" },
    "empties_default": { "type": "integer", "minimum": 1, "maximum": 3 },
    "cycle20": { "type": "boolean", "description": "El pack respeta la colocación en el ciclo de 20 (03 §12)." },
    "levels": {
      "type": "array",
      "minItems": 1,
      "items": { "$ref": "#/$defs/level" }
    }
  },
  "allOf": [
    {
      "if": { "properties": { "kind": { "const": "daily" } }, "required": ["kind"] },
      "then": {
        "properties": {
          "levels": {
            "items": {
              "required": ["slot"],
              "not": { "required": ["level"] },
              "properties": {
                "id": { "pattern": "^d[1-3]_n[0-9]{4}$" },
                "seed": { "pattern": "^amazonfill:v1:daily:b[1-3]:d[0-9]{3}$" }
              }
            }
          }
        }
      },
      "else": {
        "required": ["world", "world_id", "lap", "water_base"],
        "properties": {
          "levels": {
            "items": {
              "required": ["level", "world", "lap", "difficulty"],
              "not": { "required": ["slot"] },
              "properties": {
                "id": { "pattern": "^m[0-9]{2}_v[1-9][0-9]*_n[0-9]{4}$" },
                "seed": { "pattern": "^amazonfill:v1:m[0-9]{2}:v[1-9][0-9]*:n[0-9]{4}$" }
              }
            }
          }
        }
      }
    }
  ],
  "$defs": {
    "semver": {
      "type": "string",
      "pattern": "^[0-9]+\\.[0-9]+\\.[0-9]+([-+][0-9A-Za-z.-]+)?$"
    },
    "world": {
      "type": "integer",
      "minimum": 1,
      "maximum": 13,
      "description": "Mundo 1-13 (glosario §8)."
    },
    "lap": {
      "type": "integer",
      "minimum": 1,
      "description": "Vuelta del río (03 §10)."
    },
    "water_base": {
      "type": "string",
      "enum": ["black", "white", "clear"],
      "description": "Agua base del mundo (glosario §11): negra, blanca o clara."
    },
    "tint_id": {
      "type": "string",
      "pattern": "^[a-z][a-z0-9_]*$",
      "description": "ID de tinte de tints.json (p. ej. acai, agua_tapajos). No define índices: el índice de motor va en cuias."
    },
    "tint_index": {
      "type": "integer",
      "minimum": 1,
      "maximum": 16,
      "description": "Índice de motor de tints.json: 1-14 tintes, 15 = Barro, 16 reservado (K_motor = 16, dirección 3). En memoria BoardState guarda tinte - 1 en 4 bits."
    },
    "capacity": {
      "type": "integer",
      "minimum": 1,
      "maximum": 6,
      "description": "Capacidad de una cuia: Cuia chica 1-3, estándar 4, Cuia alta 5-6 (dirección 4)."
    },
    "mechanic_type": {
      "type": "string",
      "enum": ["hoja", "brote", "liana", "remolino", "lluvia", "pirana"],
      "description": "Tipos de attrs (02 §9.1 y §9.3; glosario §6.5). Debuts: Hoja 43, Brote 63, Liana 83, Remolino 103, Lluvia 143, Piraña 183 (mech_debut_level, 08 §9). El Barro (debut 123) no es un attr: es la unidad 15 dentro de cuias."
    },
    "caps": {
      "type": "array",
      "minItems": 1,
      "maxItems": 16,
      "items": { "$ref": "#/$defs/capacity" },
      "description": "Capacidad por cuia en orden visual. Misma longitud que cuias y attrs (lo verifica tools/level-qa). Máximo 16 ranuras en pantalla (02 §7); el generador produce <=14 (02 R1)."
    },
    "cuias": {
      "type": "array",
      "minItems": 1,
      "maxItems": 16,
      "items": {
        "type": "array",
        "minItems": 0,
        "maxItems": 6,
        "items": { "$ref": "#/$defs/tint_index" }
      },
      "description": "Capas de abajo arriba por cuia; [] = cuia vacía. Nunca en forma empaquetada ni hexadecimal."
    },
    "attr": {
      "type": "object",
      "additionalProperties": false,
      "required": ["type"],
      "properties": {
        "type": { "$ref": "#/$defs/mechanic_type" },
        "key": { "$ref": "#/$defs/tint_index", "description": "Tinte que abre la Hoja o tinte agua del mundo de la Lluvia (02 §9.1); no se llama color." },
        "partner": { "type": "integer", "minimum": 0, "maximum": 15, "description": "Índice 0-based de la cuia pareja (Remolino)." },
        "n": { "type": "integer", "minimum": 1, "description": "Liana: sellos necesarios; Lluvia: gotas programadas." },
        "k": { "type": "integer", "minimum": 1, "description": "Ritmo en vertidos de Lluvia o Piraña; si falta rige lluvia_k_pours / pirana_k_pours" }
      }
    },
    "attrs": {
      "type": "array",
      "minItems": 1,
      "maxItems": 16,
      "items": { "oneOf": [ { "type": "null" }, { "$ref": "#/$defs/attr" } ] },
      "description": "Una entrada por cuia (misma longitud que cuias); null = sin mecánica."
    },
    "hidden": {
      "type": "array",
      "minItems": 0,
      "maxItems": 4,
      "uniqueItems": true,
      "items": {
        "type": "array",
        "minItems": 2,
        "maxItems": 2,
        "prefixItems": [
          { "type": "integer", "minimum": 0, "maximum": 15, "description": "Índice 0-based de la cuia." },
          { "type": "integer", "minimum": 0, "maximum": 5, "description": "Índice 0-based de la capa oculta (de abajo arriba)." }
        ],
        "items": false
      },
      "description": "Posiciones ocultas de Aguas turbias como lista [cuia, capa] (admite ocultos no contiguos; el shader las recibe como máscara de bits _HiddenMask, 08 §5.2). Máximo lvl_murky_max_hidden_units = 4 dosis en <= lvl_murky_max_cuias = 3 cuias → <= 24 realidades (02 T2; incidencia 8). Solo si murky = true."
    },
    "difficulty": {
      "type": "object",
      "additionalProperties": false,
      "required": ["label", "bot_fail", "par", "band"],
      "description": "Obligatorio en campaign y event; opcional en daily (el pool del Reto del río se publica sin métricas, 03 §16).",
      "properties": {
        "label": { "type": "string", "enum": ["normal", "hard", "very_hard"], "description": "Deriva de bot_fail: >=0,75 hard, >=0,90 very_hard (dirección 5). Primer hard posible en el nivel 40, primer very_hard en el 60 (03 §11/§12)." },
        "bot_fail": { "type": "number", "minimum": 0, "maximum": 1 },
        "par": { "type": "integer", "minimum": 1, "description": "Vertidos de la solución del solver; tools/level-qa exige par >= 2*K." },
        "branching": { "type": "number", "minimum": 0 },
        "traps": { "type": "number", "minimum": 0, "maximum": 1 },
        "complexity": { "type": "number", "minimum": 0 },
        "D": { "type": "number", "description": "Índice de 03 §7: suma ponderada de z-scores del pool del rango; puede ser negativo" },
        "band": { "type": "string", "enum": ["comfort", "challenge", "recovery", "milestone"], "description": "Posición en el ciclo de 20 (03 §12)." }
      }
    },
    "relief_board": {
      "type": "object",
      "additionalProperties": false,
      "required": ["type", "caps", "cuias", "par", "bot_fail"],
      "properties": {
        "type": { "type": "string", "enum": ["plus_empty", "minus_color"] },
        "caps": { "$ref": "#/$defs/caps" },
        "cuias": { "$ref": "#/$defs/cuias" },
        "attrs": { "oneOf": [ { "type": "null" }, { "$ref": "#/$defs/attrs" } ], "description": "Opcional; null o ausente = sin mecánicas en la variante." },
        "removed": { "$ref": "#/$defs/tint_index", "description": "Índice de motor del tinte quitado; solo en minus_color." },
        "par": { "type": ["integer", "null"], "minimum": 1, "description": "null solo en plus_empty (03 §13)" },
        "bot_fail": { "type": "number", "minimum": 0, "maximum": 1 }
      },
      "if": { "properties": { "type": { "const": "minus_color" } } },
      "then": { "required": ["removed"], "properties": { "par": { "type": "integer" } } },
      "else": { "not": { "required": ["removed"] } },
      "description": "Tablero completo pregenerado (+1 cuia vacía o -1 color). El orden de la lista es la prioridad: relief[0] se sirve al tercer fallo consecutivo (relief_after_fails), relief[1] si existe un segundo alivio (relief_second_step_fails). minus_color lleva siempre par entero; plus_empty puede publicarse con par null (03 §13)."
    },
    "level": {
      "type": "object",
      "additionalProperties": false,
      "required": ["schema", "id", "seed", "gen", "water_base", "palette", "units_per_color", "caps", "cuias", "attrs", "murky", "hidden", "risk_pairs", "intro_mechanic", "skippable", "hint_supported", "relief"],
      "properties": {
        "schema": { "type": "string", "const": "af-level/1" },
        "id": {
          "type": "string",
          "description": "Campaña y eventos: m{mm}_v{v}_n{nnnn} con el mismo padding que la semilla (p. ej. m03_v1_n0043). Reto del río (kind daily): d{b}_n{nnnn} (p. ej. d2_n0417). Las variantes de relief no tienen id propio."
        },
        "level": { "type": "integer", "minimum": 1, "description": "Nivel de ruta (campaign y event)." },
        "slot": {
          "type": "object",
          "additionalProperties": false,
          "required": ["band", "day"],
          "properties": {
            "band": { "type": "integer", "minimum": 1, "maximum": 3, "description": "Banda del Reto del río (lvl_daily_bracket_levels = [41, 201]; K 6-7 / 8-9 / 10-11, 03 §16)." },
            "day": { "type": "integer", "minimum": 0, "maximum": 729, "description": "Día del pool (3 bandas × 730 = 2.190 tableros)." }
          },
          "description": "Solo en packs daily, en lugar de level."
        },
        "world": { "$ref": "#/$defs/world", "description": "Obligatorio en campaign y event; opcional en daily." },
        "lap": { "$ref": "#/$defs/lap", "description": "Obligatorio en campaign y event; opcional en daily." },
        "seed": {
          "type": "string",
          "description": "Campaña y eventos: amazonfill:v1:m{mm}:v{v}:n{nnnn} con ceros a la izquierda (p. ej. amazonfill:v1:m03:v1:n0043). Reto del río (kind daily): amazonfill:v1:daily:b{b}:d{ddd} (p. ej. amazonfill:v1:daily:b2:d417). Reproduce el tablero base en tools/level-generator (prueba de determinismo por hash, dirección 7)."
        },
        "gen": {
          "type": "object",
          "additionalProperties": false,
          "required": ["tool", "version", "source"],
          "properties": {
            "tool": { "type": "string", "const": "level-generator" },
            "version": { "$ref": "#/$defs/semver" },
            "source": { "type": "string", "enum": ["walk", "deep", "fill"] },
            "depth": { "type": "integer", "minimum": 0 },
            "candidates": { "type": "integer", "minimum": 0 }
          }
        },
        "water_base": { "$ref": "#/$defs/water_base" },
        "palette": {
          "type": "array",
          "minItems": 2,
          "maxItems": 14,
          "uniqueItems": true,
          "items": { "$ref": "#/$defs/tint_id" },
          "description": "Tintes presentes en el nivel (K = longitud). Sirve a la validación de debuts y de k_max; no define índices."
        },
        "units_per_color": {
          "oneOf": [
            { "type": "integer", "minimum": 1, "maximum": 6 },
            {
              "type": "object",
              "minProperties": 1,
              "propertyNames": { "pattern": "^([1-9]|1[0-6])$" },
              "additionalProperties": { "type": "integer", "minimum": 1, "maximum": 6 }
            }
          ],
          "description": "4 por defecto; objeto {\"13\": 5} con el índice de motor como clave para fruta rara."
        },
        "caps": { "$ref": "#/$defs/caps" },
        "cuias": { "$ref": "#/$defs/cuias" },
        "attrs": { "$ref": "#/$defs/attrs" },
        "murky": { "type": "boolean", "description": "Nivel de Aguas turbias (lvl_murky_from_level = 100)." },
        "hidden": { "$ref": "#/$defs/hidden" },
        "difficulty": { "$ref": "#/$defs/difficulty" },
        "risk_pairs": { "type": "integer", "minimum": 0, "maximum": 10, "description": "Pares de riesgo presentes; <= max_risk_pairs de la cabecera." },
        "intro_mechanic": {
          "enum": [null, "hoja", "brote", "liana", "remolino", "barro", "lluvia", "pirana"],
          "description": "Mecánica que debuta en este nivel (af_mechanic_intro) o null. Incluye barro (debut 123), que no es un tipo de attrs sino la unidad 15 en cuias."
        },
        "skippable": { "type": "boolean", "description": "Salto del Boto permitido." },
        "hint_supported": { "type": "boolean", "description": "Morpho permitido." },
        "relief": {
          "type": "array",
          "minItems": 0,
          "maxItems": 2,
          "items": { "$ref": "#/$defs/relief_board" },
          "description": "Lista de tableros de alivio ordenada por prioridad; obligatoria desde el nivel 31 (minItems 1 por if/then; [] antes y en el Reto del río)."
        },
        "solution": false,
        "safe_path": false,
        "qa": false
      },
      "allOf": [
        {
          "if": { "properties": { "murky": { "const": false } } },
          "then": { "properties": { "hidden": { "maxItems": 0 } } },
          "else": { "properties": { "hidden": { "minItems": 1 } } }
        },
        {
          "if": { "properties": { "level": { "minimum": 31 } }, "required": ["level"] },
          "then": { "properties": { "relief": { "minItems": 1 } } }
        }
      ]
    }
  }
}
