{
  "pack_schema": 1,
  "schema_file": "schemas/af-level-1.schema.json",
  "pack_id": "mundo_03_v1",
  "kind": "campaign",
  "generator": {
    "tool": "level-generator",
    "version": "1.3.0",
    "commit": "a1b2c3d",
    "built_at": "2026-10-05T12:00:00Z"
  },
  "world": 3,
  "world_id": "w03_manaos",
  "lap": 1,
  "water_base": "black",
  "pool": [
    "acai",
    "aguaje",
    "tapereba",
    "guanabana",
    "bacaba",
    "agua_tapajos",
    "camu_camu",
    "urucum",
    "agua_negro"
  ],
  "k_min": 7,
  "k_max": 8,
  "max_risk_pairs": 1,
  "cap_default": 4,
  "empties_default": 1,
  "cycle20": true,
  "levels": [
    {
      "schema": "af-level/1",
      "id": "m03_v1_n0043",
      "level": 43,
      "world": 3,
      "lap": 1,
      "seed": "amazonfill:v1:m03:v1:n0043",
      "gen": {
        "tool": "level-generator",
        "version": "1.3.0",
        "source": "walk",
        "depth": 20
      },
      "water_base": "black",
      "palette": [
        "guanabana",
        "tapereba",
        "aguaje",
        "urucum",
        "bacaba",
        "acai",
        "agua_tapajos"
      ],
      "units_per_color": 4,
      "caps": [
        4,
        4,
        4,
        4,
        4,
        4,
        4,
        4,
        4
      ],
      "cuias": [
        [
          8,
          1,
          3,
          5
        ],
        [
          7,
          10,
          4,
          8
        ],
        [
          4,
          3,
          10,
          7
        ],
        [],
        [
          5,
          7,
          1,
          4
        ],
        [
          3,
          8,
          5,
          10
        ],
        [
          10,
          5,
          7,
          1
        ],
        [
          1,
          4,
          8,
          3
        ],
        []
      ],
      "attrs": [
        null,
        null,
        null,
        {
          "type": "hoja",
          "key": 4
        },
        null,
        null,
        null,
        null,
        null
      ],
      "murky": false,
      "hidden": [],
      "difficulty": {
        "label": "normal",
        "bot_fail": 0.0,
        "par": 23,
        "branching": 2.39,
        "traps": 0.0,
        "complexity": 56,
        "D": -0.76,
        "band": "comfort"
      },
      "risk_pairs": 1,
      "intro_mechanic": "hoja",
      "skippable": false,
      "hint_supported": true,
      "relief": [
        {
          "type": "minus_color",
          "removed": 1,
          "caps": [
            4,
            4,
            4,
            4,
            4,
            4,
            4,
            4,
            4
          ],
          "cuias": [
            [
              8,
              3,
              5
            ],
            [
              7,
              10,
              4,
              8
            ],
            [
              4,
              3,
              10,
              7
            ],
            [],
            [
              5,
              7,
              4
            ],
            [
              3,
              8,
              5,
              10
            ],
            [
              10,
              5,
              7
            ],
            [
              4,
              8,
              3
            ],
            []
          ],
          "attrs": [
            null,
            null,
            null,
            {
              "type": "hoja",
              "key": 4
            },
            null,
            null,
            null,
            null,
            null
          ],
          "par": 19,
          "bot_fail": 0.0
        },
        {
          "type": "plus_empty",
          "caps": [
            4,
            4,
            4,
            4,
            4,
            4,
            4,
            4,
            4,
            4
          ],
          "cuias": [
            [
              8,
              1,
              3,
              5
            ],
            [
              7,
              10,
              4,
              8
            ],
            [
              4,
              3,
              10,
              7
            ],
            [],
            [
              5,
              7,
              1,
              4
            ],
            [
              3,
              8,
              5,
              10
            ],
            [
              10,
              5,
              7,
              1
            ],
            [
              1,
              4,
              8,
              3
            ],
            [],
            []
          ],
          "attrs": [
            null,
            null,
            null,
            {
              "type": "hoja",
              "key": 4
            },
            null,
            null,
            null,
            null,
            null,
            null
          ],
          "par": null,
          "bot_fail": 0.0
        }
      ]
    }
  ]
}